{
  "schemaVersion": 1,
  "id": "space-scale-ladder",
  "name": "Cosmic Scale Ladder",
  "version": "1.0.0",
  "summary": "Bodies of wildly different sizes appear side by side while the camera pulls back by orders of magnitude over a starfield, with a size readout. For 'how big is X': planets, cells, buildings.",
  "genres": [
    "comparison",
    "explainer"
  ],
  "domains": [
    "space",
    "science",
    "nature",
    "education",
    "geography",
    "generic"
  ],
  "adWeave": [
    "end-card",
    "sponsor-mention",
    "mid-roll-card",
    "none-pure-brand"
  ],
  "techniques": [
    "svg-illustration",
    "camera-motion",
    "particles",
    "captions-voiceover"
  ],
  "aspects": [
    "9:16",
    "1:1",
    "16:9"
  ],
  "durationSeconds": {
    "min": 10,
    "max": 120
  },
  "tiers": [
    "fill",
    "fork"
  ],
  "minModel": "small",
  "renderCost": "low",
  "requires": [],
  "location": "remote",
  "source": "seed",
  "inspiredBy": [
    {
      "url": "viralaunch://skills/spacevideo/ScaleLadder",
      "collection": "viralaunch"
    }
  ],
  "license": "MIT",
  "status": "approved",
  "authoredBy": "claude-opus-5-5"
}
