{
  "schemaVersion": 1,
  "id": "listicle-countdown",
  "name": "Countdown Listicle",
  "version": "1.0.0",
  "summary": "Top-N countdown: a giant rank number crashes in, then the item title and one-line why, over the scene image or a bold color field. For rankings, facts, tips, 'N things you didn't know'.",
  "genres": [
    "listicle",
    "comparison"
  ],
  "domains": [
    "generic",
    "nature",
    "sports",
    "culture-entertainment",
    "education",
    "history"
  ],
  "adWeave": [
    "end-card",
    "mid-roll-card",
    "sponsor-mention",
    "native-integrated",
    "none-pure-brand"
  ],
  "techniques": [
    "kinetic-type",
    "transitions",
    "stock-footage",
    "captions-voiceover"
  ],
  "aspects": [
    "9:16",
    "1:1",
    "16:9"
  ],
  "durationSeconds": {
    "min": 10,
    "max": 120
  },
  "tiers": [
    "fill",
    "fork"
  ],
  "minModel": "small",
  "renderCost": "low",
  "requires": [],
  "location": "remote",
  "source": "original",
  "inspiredBy": [],
  "license": "MIT",
  "status": "approved",
  "authoredBy": "claude-opus-5-5"
}
